question,meta,answer
Can my family members continue to stay with me during this time? Are they at risk of infection? ,Ministry of Health.,"Seek medical attention if you are unwell. Please wear a surgical mask before leaving your residence and avoid taking public transport. Please inform the staff and doctor of your travel history. Your doctor will assess your health and may refer you to hospital if further assessment is necessary. If you are subsequently admitted and tested positive for COVID-19, you will be treated in an isolation room, until you are well enough to be discharged."
What will happen if I am unwell? Will I be isolated if I turn out to be a confirmed case subsequently?,Ministry of Health.,"Yes, this advisory applies only to persons returning from mainland China. However, you should minimise contact with persons under LOA. Those on LOA and others who are living together should continue to monitor your health, observe good personal hygiene and seek medical attention if unwell."
"My flatmates/ tenants have just returned from mainland China. Can I still carry on with my daily activities (e.g. work, school)? ",Ministry of Health.,Person who have returned from mainland China are advised to inform their employers or schools regarding their travel history. This is so that your employer or school can provide the necessary assistance to facilitate your leave of absence.
Do I need to declare to my employers/schools regarding my travel history? ,Ministry of Health.,"Diagnostic testing is available for symptomatic individuals who are admitted to hospital on suspicion of infection. If you develop fever, cough or breathlessness, or are feeling unwell, you should wear a mask and seek immediate medical attention at any outpatient clinic. Your doctor will assess and refer you to the hospital if necessary."
"If I am worried about my status (whether or not I am infected), can I go to hospital / National Centre for Infectious Diseases (NCID) to get tested? ",Ministry of Health.,"Diagnostic testing is available for symptomatic individuals who are admitted to hospital on suspicion of infection. It is therefore not useful to send employees who do not have symptoms to the doctor/ hospital for testing. Such individuals will not be offered diagnostic testing, and will be asked to return home."
Can I send my employees/ students to the doctor to get tested at the end of the 14-day LOA period so that they can be cleared to come back to work/return to school?,Ministry of Health.,"Health advisories and latest information on the local disease situation is available on the Singapore Ministry of Health website at www.moh.gov.sg. For queries, please call the MOH general enquiry hotline at 6325 9220. For the latest global disease situation, you may wish to refer to information on the World Health Organisation website at www.who.int."
Can someone live in the same room as a person on LOA?,Ministry of Health.,"While you can live in the same room as a person on LOA, you are encouraged to reduce interaction and minimise contact with a person on LOA. For example, avoid sharing a bed, limit the time spent together at common areas within the apartment, have separate meal times, ensure that the room has proper ventilation etc."
Can persons on LOA share the same toilet as other occupants in the same household?,Ministry of Health.,"You are advised to avoid sharing the same toilet where possible. If it is not practical to do so, avoid using the toilet at the same time and clean toilet surfaces more frequently. You may also wish to allow some time to pass between toilet usage, in order to allow any remaining water droplets after showers to settle to the ground. Sharing the same roll of toilet paper is safe as long as the toilet roll is not stained, soiled or wet.Sharing of towels is not advised."
I operate a dormitory. Do I need to segregate a person on LOA from other occupants of the dorm?,Ministry of Health.,"While persons on LOA can stay in the same dormitory room as others, where possible and practical, measures to minimise contact between a person on LOA and other occupants are encouraged. Examples of these could include separating belongings of workers to minimise overlapping circulating space, having separate meal times, ensuring proper ventilation, etc.Sharing of beds is not advised."
"With the move to DORSCON Orange, what measures are MOE taking?",Ministry of Education.,"We have further enhanced our measures by suspending all inter-school activities and external activities until the end of the March school holidays. These include the National School Games and learning journeys. This is to help schools minimise prolonged exposure of students to the public and reduce intermingling of students across schools. This is on top of the precautionary measures that are already in place to minimise congregation of students in large numbers. These include: 
Suspension of large group and communal activities such as assemblies, camps and mass celebrations
Staggered recess times
 School-based CCAs and after-school programmes may continue but in smaller groups.   "
Why is my child sent home when he does not seem to have a fever? How are schools assessing if a child is unwell? How is MOE aligning these practices across schools?,Ministry of Education.,"Schools conduct temperature-taking exercises daily. If a child’s temperature is 38 degrees Celsius or higher, the school will contact the parents to ask that he be taken to see a doctor. Schools also look out for other flu-like symptoms such as cough and runny nose, and will suggest to the student to see a doctor. There are also times when a child may inform his teacher that he is unwell, even though he may not be running a fever or showing symptoms. In these cases, we hope students and parents can all play their part and practise social responsibility by seeing a doctor first before coming to school. Students should return to school only when they have fully recovered.   "
"Will mass events involving staff and stakeholders, such as activities with Parent Support Groups and Alumni celebrations, continue? What measures will be put in place?",Ministry of Education.,"Mass events with staff and stakeholders, but not involving students, can continue. Schools will also put in place visitor management measures, such as temperature screening and travel declarations, to safeguard the well-being of participants. MOE will advise external organisers using our school premises to do the same and take the necessary precautions.   "
Why implement the social distancing measures now?,Ministry of Education.,"We are constantly reviewing our measures to protect our schools and students, and update them based on the evolving situation and risk assessment. Before 4 February 2020, all of the confirmed cases were imported ones, with no local transmission. The announcement on 4 February by MOH of a few cases with no travel history to China marked a new phase of local transmission. Hence, MOE decided to stop mass events in schools like assemblies and camps.  Given that there is no evidence of community spread as yet, there is no need to stop mass events but we are taking precautions for vulnerable groups, such as pre-schools and school children.   "
What MOE is doing is not fool proof. What more can we do to protect our students?,Ministry of Education.,"No measure is 100% fool proof or guaranteed, but we will take the necessary precautions to contain and manage the risks, while enabling life to go on. There are two key threats we face in such an outbreak situation. First is the virus itself. We have various measures based on medical evidence that are targeted at limiting its spread. Second which is more insidious, is fear. It prevents us from doing the things we love to do and have to do. We must remember that to be deprived of our daily lives and activities – to study, learn, play, socialise with friends, visit places we like, help people in need – over a prolonged period will make life miserable for everyone and disrupt society. In tackling fear, we must as a society be resilient. We should not let fear of the virus get the better of us and prevent us from going about our daily lives. We should stay vigilant and calm, cooperate as a society, do our part and be socially responsible. Some of the most effective measures are in our own hands – wash them regularly with soap and water, and keep them away from our faces so that we reduce the risk of infection to ourselves and our loved ones, help to contain the threat, while allowing life to go on as normally as possible.   "
The World Health Organisation (WHO) has declared a public health emergency of international concern over the novel coronavirus (COVID-19). Should we review the precautionary measures that are in place in our schools?,Ministry of Education.,We review measures and closely monitor the situation constantly. We will take the necessary precautionary measures as the situation evolves. But we all can and should continue to do our part to protect ourselves by adopting good hygiene habits and practising social responsibility by seeking medical attention if we are unwell.   
Can schools provide hand sanitizers in all classrooms?,Ministry of Education.,Personal hygiene is indeed important. But hand sanitizer is not necessary if we wash our hands thoroughly and regularly with soap. Some individuals may also be sensitive to sanitizers. Toilets in our schools and IHLs are well stocked with liquid soap. We will also be stepping up the cleaning of toilets to ensure they are clean.   
Do the precautionary measures by the Ministry of Education (MOE) also apply to tuition and enrichment centres?,Ministry of Education.,"Tuition and enrichment centres are private entities. Nevertheless, we strongly urge them to exercise the same responsibility and take reference from the measures MOE has instituted.   "
Why not close schools when DORSCON was changed to Orange?,Ministry of Education.,"DORSCON Orange means we need to take more precautions, because there are now a few cases of community spread.  In fact, many of the measures schools have taken are already DORSCON Orange measures. Closing school will disrupt many lives. We don’t rule it out when required, but it is a major, major decision. One thing to consider is that even if all students stay at home, there is no guarantee against infection. Lots of infections happen at home actually. It is also unrealistic to expect older kids to stay at home. They will go out and inter-mingle. See this interesting article: https://www.mothership.sg/2020/02/japan-family-virus-experiment/ On the other hand, in schools, we have suspended large gatherings to reduce inter-mingling drastically. There is also a tight regime of personal and group hygiene. Should there be wide community spread, which we hope will not happen, schools can be one of the safest places in Singapore against the COVID-19 virus. We will continue to monitor the situation closely, in the best interest of our students.   "
Can schools be one of the safest place for students?,Ministry of Education.,"Staff and students are already on extra alert. We are calling on all our teachers and staff to help make this happen. Hygiene is a major determinant of risk of transmission, so personal and group hygiene standards have been raised.  There is constant supervision (for the younger students) and reminders for all students to wash their hands properly and regularly, avoid touching their faces.  As a group, students will clean up after use. In terms of activities, we have scaled down all mass activities, to minimise inter-mingling.   "
Can we be assured that there will be no infection in school?,Ministry of Education.,"We have posed ourselves this difficult question, which deserves an honest answer.  We cannot ensure that there will not be any infection if we close all schools, neither can we guarantee that there will not be any infection by keeping schools open. If there is wide community spread, chances are some students may be infected. But we will certainly do our best to make schools one of the safest environments in that scenario.   "
"Even if schools are safe, how about the journey to and from school?",Ministry of Education.,"Our public transport operators will maintain high standards of cleanliness and hygiene too.  But as commuters, we should also play our part.   Remind your child to wash his or her hands with soap before the journey, and not to touch their faces.  When they are in school, they will be reminded to wash their hands with soap again.   "
Why are schools still continuing with CCAs and PE lessons? ,Ministry of Education.,Schools will take appropriate steps for CCAs and PE lessons to ensure that group sizes are small to limit any risk of transmission. We want schools to continue with as many of their usual learning and activities as possible. They are ready to step up their measures if need be.    
"Will all swimming lessons be cancelled? What about pool-based CCAs, such as Swimming, or Water Polo?",Ministry of Education.,"All external school activities will be suspended until the end of the March school holidays. Pool-based CCAs that require students to travel to swimming pools outside of their school compound, such as Swimming, or Water Polo, and programmes like SwimSafer, will be suspended.   "
"Why not delay the opening of schools for 7 or 14 days, like what Hong Kong did?",Ministry of Education.,"We had considered this, took advice from medical experts, and concluded that it is not necessary to do so, because there is currently no evidence of widespread sustained community transmission. Ours is a different situation compared to Hong Kong's. Hong Kong is closer to the epicentre of the novel coronavirus (COVID-19) outbreak and is closely connected to Mainland China. The number of students and staff returning from Mainland China are likely to be many times ours. We assessed that the number of students and staff returning from China recently is manageable, and a 14-day Leave of Absence (LOA) will be more targeted, while allowing schools to open and life carry on as normally as possible, which is an important aspect to safeguard in an emergency situation.   "
I heard of cases where students travelled to China and did not declare. How do we ensure that everyone does the responsible thing?,Ministry of Education.,"If you come across cases where the person didn’t declare his or her travel to China, do let the school know and they will follow up with checks. We had received some feedback on such persons, but upon further checks, we found that they had returned from China in Dec 2019. This is well over the incubation period, so the Leave of Absence (LOA) will not apply to them.  Since we announced the LOA measure, we have received more travel declarations as people return from the Chinese New Year public holiday. As of 29 Jan 2020, we have about 960 students and staff on LOA.   "
How are schools supporting students on LOA with their studies?,Ministry of Education.,"It involves a variety of methods; it need not be confined to e-learning or learning with computers. Schools will plan and implement a home based learning programme that best suits the lessons and the needs of their students. For example, schools may inform their students on specific pieces of homework or readings from their textbooks. Sometimes, for subjects like Art, hard copy packages may be dropped off at the student’s home by the school. Schools may also ask students to go through online materials in the Singapore Student Learning Space or the Learning Management Systems. Teachers will also be able to monitor the students’ learning progress through these systems.   "
I understand that primary school and MOE Kindergarten students who are close contacts of Persons Under Quarantine (PUQ) also need to observe a Leave of Absence (LOA). Why is this necessary?,Ministry of Education.,"The Home Quarantine Order (HQO) is issued to healthy persons who have recently returned from Hubei, and for those in close contact with a confirmed case. There may be young children living in the same household, and being young, they may be not be so aware of the precautions they need to take to protect themselves when staying with someone on HQO. So we have decided to take the step of issuing LOA to these young children as an additional precautionary measure. This will give their fellow students and parents added assurance.   "
"What if students or staff who are on LOA do not stay home, and move around in public areas?",Ministry of Education.,"There is a difference between an LOA and a Quarantine Order (QO). A QO is served to healthy individuals who have a higher risk of exposure to the virus, such as someone who has close contact with an infected person.  QOs have legal force, with severe penalties for non-compliance. Quarantine usually occurs in the home but can also be served in dedicated Government Quarantine Facilities (GQFs) or hospitals, should the individual not have suitable accommodation in Singapore. An LOA is also issued to students and staff who are healthy, but have recently travelled to Mainland China. So it is a precautionary measure. Although LOAs are not legally binding, we strongly urge those on LOA to be socially responsible and comply with the LOA, to prevent possible transmission of infections. The students and staff on LOAs are not required to stay at home and be isolated at all times. During the LOA, students and staff are expected to: 
Remain contactable at all times
Remain in the place of residence as much as possible
Minimise visitors to the place of residence
Minimise time spent in public places and contact with others
Monitor their health and their temperature
(For Students) Follow their home-based learning plan closely to continue with their learning
   "
"Are vendors, canteen staff, freelance coaches also covered under the LOA measure?",Ministry of Education.,"Yes. The LOA provisions cover teaching staff, non-teaching staff, such as administrators, and other non-school staff, including canteen vendors, security guards, KCare and Student Care Centre staff.   "
"How about students and staff who did not come back from China recently, but had relatives from China visiting them?",Ministry of Education.,"As explained earlier, the LOA is a precautionary measure.  Like all precautionary measures, we have to decide how wide to cast the net.  If we include those who have visitors from Mainland China, the same logic should apply to those whose friends or families have recently been to China.  The net can grow exponentially wide.  So we decided to apply the LOA directly to those who have visited China.  Those who have close contact with people on LOA should closely monitor their health and adopt good hygiene practices. Those who feel unwell should seek medical assistance.   "
What if students or staff do not declare their travel history?,Ministry of Education.,"We urge them to spare a thought for others and do so. Their friends and families, if they know about their travels, should also urge them to do so. All of us play a part in ensuring the safety and well-being of ourselves, our loved ones and our society. We should do the responsible thing and declare our travel history, and see a doctor if unwell. Ultimately, we can only overcome this virus with the co-operation and public spiritedness of everyone in Singapore.   "
Why do we allow university dorms to be designated as Government Quarantine Facilities (GQFs)? Will allowing this put the wider student population at risk?,Ministry of Education.,"Currently, there are three university hostels designated as Government Quarantine Facilities (GQFs) – designated blocks at the National University of Singapore's (NUS) Prince George's Park Residences, Nanyang Technological University's (NTU) Graduate Hall 1, and Singapore Management University's (SMU) Blk 83 Prinsep St. They have always been part of the Government's national contingency plan for a disease outbreak. We are getting them ready to be on standby, should the number of people served with QO goes up. The designated hostels will only be primarily activated when a student in our educational institutions or schools is required to serve QOs and does not have suitable accommodation. Persons served QOs are required to stay in their designated rooms at all times within the allocated quarantine period.  They are not allowed to use common facilities within the GQF.  There will be no visitors, and food and all necessary supplies will be delivered to them. There are also security measures in place to ensure compliance to GQF guidelines. All staff working at the GQF are also provided with personal protective equipment, such as masks, as advised by the Ministry of Health (MOH). GQFs also undergo rigorous cleansing and hygiene regimes according to MOH and National Environment Agency (NEA) guidelines. In other words, the persons will not be mingling with the larger population around them. "
