question,meta,answer
Can organisations terminate a DNC Registry account and request for a refund of the account creation fee?,"Organisations, Do Not Call Registry
","Requests for a refund of account creation fees are subject to review and approval by PDPC on a case-by-case basis. You may request for refund for the account creation fee by sending an email to info@pdpc.gov.sg after you have submitted an account termination request through your DNC Registry account. The PDPC will follow general guidelines when considering a request for a refund, such as: the termination request should be submitted within 14 calendar days from date of account creation; the free credits are not utilised; andthere is a valid reason for the refund request."
When must an organisation check the DNC Registry?,"Organisations, Do Not Call Registry
","Organisations need to check the DNC Registry before sending marketing messages to a Singapore telephone number. Organisations may rely on the information given by the DNC Registry on whether any number is registered on any of the registers for up to 30 days. If the organisation intends to send the marketing message after the 30 days has lapsed, it must check the DNC Registry again."
How can an organisation check the DNC Registry?,"Organisations, Do Not Call Registry
",There are two methods an organisation can check its list of numbers against the Registry:Small Number Lookup - for up to 10 numbers at a time. Results will be displayed immediately.Bulk Filtering - for upload of as many numbers as required in a CSV file. Results will be returned within 24 hours. An email notification will be sent once the results are ready.
Can an organisation directly upload its list of telephone numbers to the DNC Registry?,"Organisations, Do Not Call Registry
",Organisations will be able to directly upload a list of telephone numbers to the DNC Registry via the Bulk Filtering method. The list of numbers has to be in CSV format.
"If an organisation checks on behalf of another organisation, does the latter also need an account with the DNC Registry?","Organisations, Do Not Call Registry
",The latter organisation does not need to create an account. Only the organisation doing the checking will need an account.
What is the validity period of the telephone numbers that have been submitted to the DNC Registry for checking?,"Organisations, Do Not Call Registry
","From 2 July 2014, results received from the DNC Registry are valid for 30 days."
Will organisations be required to develop IT systems in order to check the DNC Registry?,"Organisations, Do Not Call Registry
",No development of an IT system is necessary. Organisations will simply have to create an account with the DNC Registry and submit their list of Singapore telephone numbers online for checking.
Can an organisation link its own system with the DNC Registry to facilitate checks?,"Organisations, Do Not Call Registry
",The current design of the DNC Registry does not allow direct Application Programming Interface (API) connection to an external system for security reasons.
Does the PDPC endorse any third-party aggregator that offers to check the DNC Registry on behalf of others?,"Organisations, Do Not Call Registry
",The PDPC neither endorses nor recommends any third-party service provider to help organisations check the DNC Registry on their behalf. Organisations that engage such services should ensure that they have a contractual agreement with the third-party service provider that clearly indicates the roles and responsibilities with regard to checking the DNC Registry.
Can organisations request for a refund of the duplicate numbers or duplicate files that were submitted for checking?,"Organisations, Do Not Call Registry
","The DNC Registry will automatically filter out invalid format telephone numbers and will not check them.  No credits will be charged for these invalid numbers. However, the onus is on the organisation to ensure that their list of telephone numbers submitted does not contain duplicate telephone numbers as they are considered valid telephone numbers. Once the DNC Registry has processed your submission, the credits will be deducted for every valid telephone number checked against the DNC Registry. You may write in to  info@pdpc.gov.sg to request for a refund for checks made on duplicate file or duplicate telephone numbers that you have submitted. However, this is subject to the PDPC's approval."
What is the difference between purchasing credits through the pre-paid and pay-per-use methods?,"Organisations, Do Not Call Registry
","Pre-paid refers to purchasing credits in advance, or when there are insufficient remaining credits at the point of checking the Registry. Purchased credits are valid for up to 3 years from the date of purchase.Pay-per-use refers to paying a fee each time to submit telephone numbers for checking. The minimum purchase value is $10. Prices will be rounded to the nearest cent."
How soon can an organisation use the credits purchased?,"Organisations, Do Not Call Registry
","Credits purchased through online payment options will be immediate. For offline payments, the credits will be credited only after the PDPC has received the payment. This can take up to 7 working days."
Are the credits separately tagged to each main or sub-account?,"Organisations, Do Not Call Registry
","The credits for each account are independent of one another. This means that each main or sub-account may purchase and use its own credits. The main account can also transfer credits to its sub-account(s) and vice-versa. However, sub-accounts cannot transfer to other sub-accounts."
Can the credits be transferred between sub-accounts?,"Organisations, Do Not Call Registry
","The main account may transfer its credits to the sub-accounts and vice-versa. However, the sub-account cannot transfer to other sub-accounts."
Will unused credits be refunded?,"Organisations, Do Not Call Registry
","Organisations can get a refund of their pre-paid credits when their main account is terminated or when their credits have expired three years from the date of purchase. When sub-accounts are terminated by the main account holder, the pre-paid credit balance will be returned to the main account holder.Organisations are required to provide their bank account details in the DNC Registry system so that refunds can be processed. The refund will be processed within four to six weeks after we have received the bank account details.Please note thatthere is no extension of any unused credits beyond the expiry date."
"Can organisations opt for offline payment for transactions less than $5,000?","Organisations, Do Not Call Registry
","The offline payment methods offered are via telegraphic or bank transfer and a minimum $5,000 transaction is required."
Can organisations get a refund of the pre-paid credits that they have purchased but not utilised?,"Organisations, Do Not Call Registry
","Generally, unused pre-paid credits will be refunded to the main account holder when the main account is terminated or when the pre-paid credits has expired after 3 years. However, you may write in to the PDPC at info@pdpc.gov.sg to request for a refund on unused pre-paid credits at any point subject to the approval of the PDPC."
Must all organisations appoint a data protection officer?,"Organisations, Data Protection Officers
","All organisations, including sole proprietorships, are required to designate at least one person, a Data Protection Officer (DPO), to be responsible for ensuring that the organisation complies with the PDPA. Organisations are also required to ensure that at least one DPO's business contact information is made available to the public. The business contact information may be a general telephone or email address of the organisation.The DPO may be a person whose scope of work solely relates to data protection or a person in the organisation who takes on this role as one of his multiple responsibilities. To be clear, compliance by the organisation with the PDPA remains the responsibility of the organisation notwithstanding the appointment of the data protection officer."
Must the data protection officer be an employee based in Singapore?,"Organisations, Data Protection Officers
","The PDPA does not prescribe where the Data Protection Officer (DPO) should be based. The DPO need not be an employee of the organisation, and organisations may outsource this function to a third party. However, the DPO whose business contact information is provided has to be reachable whenever a member of the public in Singapore attempts to contact him, to be compliant with the PDPA requirements."
Is it mandatory for a holding company (with no employee) to appoint a DPO?,"Organisations, Data Protection Officers
",An organisation is responsible for all personal data in its possession or under its control. This may relate to not just employees' data but personal data of other persons such as clients or shareholders. The PDPA requires an organisation to designate one or more individuals to be responsible for ensuring compliance with the PDPA.
Do I need to appoint a DPO if my company is going to cease its operations in a few months' time?,"Organisations, Data Protection Officers
","Your company will have to ensure compliance with the PDPA as long as it is collecting, using and disclosing personal data, or has persona data in its possession or control. This includes appointing a DPO."
Does the DPO have to meet any minimum age criteria?,"Organisations, Data Protection Officers
","The PDPA does not stipulate a minimum age for DPOs. However, the appointed person should, for example, have the appropriate expertise and knowledge to be able to ensurethat the organisation complies with the PDPA and develop a process to receive and respond to complaints with respect to the application of the PDPA."
Where can a DPO register with the PDPC?,"Organisations, Data Protection Officers
","DPOs may register at www.pdpc.gov.sg/dpo-contact. Once the online submission is successful, an acknowledgement email will be sent tothe email address provided. If you did not receive the acknowledgement email,please check your spam folder. For further assistance, please contact us here."
Is it mandatory to submit my organisation's DPO details to the PDPC?,"Organisations, Data Protection Officers
",It is not required under the law to inform the PDPC of your DPO's details but we strongly encourage all organisations to do so. This will help DPOs keep abreast of relevant personal data protection developments in Singapore.
Is there any fee involved in the DPO registration process?,"Organisations, Data Protection Officers
",There is no fee involved in the DPO registration process.
Is there a deadline to register the DPO?,"Organisations, Data Protection Officers
","There is no deadline to register your DPO. However, we strongly encourage your organisation to register your DPO asearly as possible so that he/she can be kept abreast of relevant personal data protectiondevelopments in Singapore."
What should I do if I encounter technical difficulty when registering DPO information on the website?,"Organisations, Data Protection Officers
",You may wish to email us at info@pdpc.gov.sg and provide the following information:1. Name of DPO2. Email address3. Contact number4. Name of organisation5. Industry6. Subscribe to DPO Connect: Yes / No / Already subscribedWe will update our records accordingly.
My company is currently undergoing liquidation and does not have any customer/employee personal data in possession. Do we still need to register our DPO?,"Organisations, Data Protection Officers
",A company that is undergoing liquidation need not registerits DPO contact details with us.
My company is dormant and has no business activity. Do we still need to register our DPO?,"Organisations, Data Protection Officers
",A company that is dormant and has no business operation need not register its DPO contact details with us.
When is the due date for the appointment of a DPO?,"Organisations, Data Protection Officers
","The data protection provisions of the PDPA came into force on 2 July2014and requires an organisation to designate one or more individuals to be responsible for ensuring compliance with the PDPA. If your organisation handles personal data, you should appoint at least one individual as the DPO."
How will the PDPC conduct an investigation into a DNC offence?,"Organisations, Enforcement
","After a complaint is received, the PDPC may carry out preliminary investigations and make enquiries to the organisation to clarify the situation or obtain more information. If the PDPC has reasonable grounds to suspect that the PDPA has been infringed, the PDPC may issue a notice requiring the organisation to provide evidence of clear and unambiguous consent. In certain circumstances, the PDPC has the power to enter premises to obtain the evidence in the form of documents, equipment or information. Any person who obstructs or impedes the PDPC or an authorised officer in the exercise of their powers under the PDPA will be guilty of an offence and may be liable:in the case of an individual, to a fine of up to $10,000 or to imprisonment for a term not exceeding 12 months or to both; andin any other case, to a fine not exceeding $100,000."
What are the penalties for DNC Registry related offences?,"Organisations, Enforcement
","Any person who contravenes section 43(1), 44(1) or 45(1) of the PDPA, which relate to the sending of specified messages, shall be guilty of an offence and shall be liable on conviction by the courts to a fine of up to $10,000. However, PDPC may compound such an offence for a sum not exceeding $1,000 per offence."
Do organisations have to keep records of 'clear and unambiguous consent' by individuals and when do organisations need to show that such consent was obtained?,"Organisations, Enforcement
","The PDPC adopts a complaint-based approach for the enforcement of the DNC provisions. An individual who has registered his/her telephone number with the DNC Registry but still continues to receive telemarketing messages from an organisation can report the matter to the PDPC for investigations. The PDPC encourages individuals who are unsure as to why they have received the message from the organisation, or whether they have provided clear and unambiguous consent, to contact the organisation to confirm this. However, in the event of a dispute, or an investigation by the PDPC, the onus will be on the organisation to prove that they have obtained 'clear and unambiguous' consent from the individual to be contacted for telemarketing activities."
Can an organisation carry on with business during an inspection by the PDPC?,"Organisations, Enforcement
","This will depend on the circumstances of the case. The PDPC may require the business or part thereof to cease when the inspection is carried out, if it feels that the continuation of business or part thereof is likely to obstruct, hinder or delay the investigations. The PDPC may also cordon off part of the premises or seal cabinets, etc, to prevent tampering of the documents stored within."
Will the PDPC take away any original documents during an on-site investigation?,"Organisations, Enforcement
","When entry into an organisation's premises is done with a warrant, the PDPC is entitled to take away original documents if it appears necessary to preserve or prevent interference with the documents, or when it is not reasonably practicable to take copies of the document on the premises. However, the organisation may request for a copy of the document and such a copy will be provided as soon as practicable."
What can an organisation do if it does not have any of the documents or information which the PDPC has requested for it to produce during an investigation?,"Organisations, Enforcement
","The organisation should immediately inform the PDPC if it is unable to produce any documents or information, and state to the best of its knowledge and belief, where such documents or information may be found. The organisation must also inform the PDPC of the reasons for not being able to produce any documents or information, where appropriate."
Can the PDPC enter an organisation's premises without a warrant?,"Organisations, Enforcement
","The PDPC may also effect entry into any premises without a warrant and without notice, if a PDPC inspector has reasonable grounds for suspecting that the premises are, or have been, occupied by an organisation which is being investigated in relation to a contravention of the PDPA (and the inspector has taken reasonable practicable steps to give notice but has not been able to). An inspector of the PDPC or person assisting the inspector entering the premises may:take with him such equipment as appears to him to be necessary;require any person on the premises -  to produce any document which he considersrelates  to any matter relevant to the investigation; andif the document is produced, to provide anexplanation of it;require any person to state, to the best of the person's knowledge and belief, where any such document is to be found;take copies of, or extracts from, any document which is produced;require any information which is stored in any electronic form and is accessible from the premises and which he considers relates to any matter relevant to the investigation, to be produced in a form - in which it can be taken away; andin which it is visible and legibletake any step which appears to be necessary for the purpose of preserving or preventing interference with any document which he considers relates to any matter relevant to the investigation."
Can an organisation request for legal advice before the PDPC enters its premises?,"Organisations, Enforcement
","If the PDPC enters into an organisation's premises, the organisation may request for its legal advisor to be present. The PDPC will allow a reasonable time for the organisation's legal advisor to arrive before entering the premises, provided that it is reasonable in the circumstances and does not cause undue delay or impede investigations. The request may also be subject to the organisation's compliance with certain conditions as may be considered appropriate, which may include (without limitation) sealing of cabinets, keeping business records in the same state and place as when entry into the premises was effected, suspending external emails and allowing the inspector to remain in occupation of selected offices. The PDPC may immediately effect entry into an organisation's premises if the organisation's internal legal advisor is on site or if prior written notice had been given to the organisation."
"If an organisation has certain security policies such as the prohibition of entry to those with cameras or laptops, can the organisation stop the PDPC from bringing such items into its premises?","Organisations, Enforcement
","When entering into premises under a warrant, the PDPC may take such equipment as appears to be necessary for the investigations. The PDPC would, however, consider the occupant's reasons and representations behind such security policies and may bear them in mind, as far as practicable in the circumstances, when using such equipment."
Will the complaints be investigated by the PDPC and enforcement actions be taken in every instance?,"Organisations, Enforcement
",Not all complaints will be investigated by the PDPC. The PDPC will review the complaints received and may also choose to address a complaint through alternative methods such as facilitation or mediation. Cases that fall under other legislation will be referred to the respective agencies for follow-up action.
Under what circumstances will the PDPC commence and initiate an investigation into the public's complaints?,"Organisations, Enforcement
","In general, the PDPC may commence an
investigation either upon receiving a complaint from an individual against an organisation or of its
own motion. Upon receiving a complaint or other information
that indicates that an organisation has or may have contravened the PDPA, the PDPC will
first consider:a) Whether the matter may be more appropriately resolved in the manner set out in Part II of these Guidelines, that is, by resolving the underlying dispute between the complainant and the organisation. Additionally, when a complaint relates to access and correction matters, the PDPC will generally conduct a review instead of an investigation; andb) Otherwise, the PDPC may commence an investigation into the conduct of an organisation if the PDPC considers that an investigation is warranted, based on the information it has obtained."
Under what circumstances will the PDPC refuse to conduct an investigation?,"Organisations, Enforcement
","Some of the circumstances under which the PDPC may refuse to conduct an
investigation includes, but are not limited to, the following situations:a)
The Complainant and the organisation have
mutually agreed to settle the matter; b) The Complainant has commenced legal
proceedings against the organisation in respect of the contravention or alleged
contravention of the PDPA by the organisation; orc) The
PDPC is of the opinion that the complaint is frivolous or vexatious or is not
made in good faith."
What sort of punishment will be meted out to the organisations following a conclusion of an investigation related to a data protection concern?,"Organisations, Enforcement
","The PDPC has the power to issue directions to
secure an organisationâ€™s compliance with the Data Protection Provisions as set
out in the PDPA. The directions may instruct the organisation as follows:a) To stop collecting, using or disclosing personal data in contravention of the PDPA;b)To destroy personal data collected in contravention of the PDPA;c)Comply with any direction of the PDPC concerning access and correction under the PDPA; andd) To pay a financial penalty of such amount not exceeding $1 million as the PDPC thinks fit."
Will the PDPC respond to all guidance applications?,"Organisations, Guidance
",The PDPC will assess each application and seeks to review genuine complex cases that are not covered in the published FAQs or advisory guidelines on the PDPC website. The PDPC may refer applicants to existing guidelines if the scenarios are already covered therein.
How soon can an organisation expect a response from the PDPC?,"Organisations, Guidance
","In the event that the guidance application is accepted and depending on the level of complexity or uniqueness of the issues involved, the PDPC aims to provide its response within 60 days. A longer period may be required for more complex or novel cases."
Will guidance still be available when the PDPA is fully enforced?,"Organisations, Guidance
","The goal of guidance is to provide organisations greater clarity on compliance with the PDPA. Thus, guidance will continue to be available even after the PDPA comes into full effect on 2 July 2014."
"If the PDPC has agreed to provide guidance on an organisation's practices, will its practices be considered in breach of the PDPA while awaiting PDPC's guidance on these practices?","Organisations, Guidance
","The PDPC's powers to investigate and enforce the PDPA are not fettered by the guidance process and the PDPC may commence an investigation based on information provided by the applicant, or use the information provided by the applicant in an investigation."
"If an organisation's application is selected, will it be published?","Organisations, Guidance
","The PDPC may publish all or parts of the guidance provided to allow similarly-situated organisations to also benefit from the clarity provided in guidance issued by the PDPC. However, if the organisation considers any part of the information submitted as confidential, it can set out that part of the information separately and provide an explanation as to why the information is confidential. The PDPC will take such requests into consideration and will notify the organisation in advance if it intends to publish the guidance provided."
What is the scope of the guidance?,"Organisations, Guidance
","The guidance is not legal advice or an opinion of the PDPC on the organisation's legal position. The intention of the guidance is to highlight the requirements of the PDPA and aid organisations in their review of their current personal data protection processes. An organisation should consider the matters noted by the PDPC in the guidance and decide on its preferred course of action, if necessary, with further advice from its legal advisors and other consultants."
How can an organisation follow up on a guidance query sent?,"Organisations, Guidance
",Please call our general enquiries hotline at 6377 3131 or contact us here to enquire on the status.
How can the Advisory Guidelines help organisations?,"Organisations, Advisory Guidelines
",The Advisory Guidelines (Guidelines) are sets of guidance on the manner in which the PDPC will interpret provisions of the PDPA.  These Guidelines aim to give organisations and individuals greater clarity by elaborating the specific requirements and obligations under the PDPA. The Guidelines also illustrate some good practices which organisations can consider adopting.
Will an organisation be considered compliant with the PDPA so long as it adheres to the Guidelines?,"Organisations, Advisory Guidelines
",The PDPC will take reference from the Guidelines when conducting an investigation but they are not binding on the PDPC. The PDPC will make an assessment based on the specific circumstances of the case.
Are the Guidelines considered legal advice by the PDPC?,"Organisations, Advisory Guidelines
",The Guidelines do not constitute legal advice. They are advisory in nature and are not legally binding on the PDPC or any other party.
